{
  "schemaVersion": "3.0",
  "launchId": "integrated-robotic-handling-v3",
  "status": "live-verified",
  "launchDigest": "0046d640d935e28619a61a15939d661a57ea72023201c73047f03342baff6cb8",
  "packetDigest": "b8622ce708f8e7464b3a1c22c11afcadc5ae9117c388ced617713b549397579f",
  "packetBundleDigest": "5f8081cc853a0665729885c4cfb3ac9883a8ecb7e1dff0a78c96e24f2391a053",
  "executionContractDigest": "676b7116dea227f181a3d7f072e542f09bdc1b738816a9e246b3273c7cb0c194",
  "canonicalBaseUrl": "https://naoyamd.github.io/rotorbench",
  "promptSha256": "e06bf42926526485f04b2b880f46052a16a59aeefce61d17f1098e5e911d0a1c",
  "updatedAt": "2026-07-30T08:44:01.852Z",
  "engineeringReviewDigest": "350c679cdf9a2e5b743bbf8d8995de5e29113f77e6deab5531f79f0d71cc470b",
  "protocolReviewDigest": "1ebe4c88b8badb8823256888364e79daa3714b1e9f5e7dd52351a47b482269b7",
  "approvalAttestation": {
    "expectedLaunchDigest": "0046d640d935e28619a61a15939d661a57ea72023201c73047f03342baff6cb8",
    "engineeringReviewDigest": "350c679cdf9a2e5b743bbf8d8995de5e29113f77e6deab5531f79f0d71cc470b",
    "protocolReviewDigest": "1ebe4c88b8badb8823256888364e79daa3714b1e9f5e7dd52351a47b482269b7",
    "statement": "APPROVE RELEASE 0046d640d935e28619a61a15939d661a57ea72023201c73047f03342baff6cb8",
    "attestedAt": "2026-07-30T07:56:43.990Z"
  },
  "approvalAttestationDigest": "85ed4d7fb7bfa51e04a8e3598d3748058650608dc927d1a56069323faf20ef8f",
  "liveVerificationDigest": "b1801c7f4ea3f55459f6e02adeda563c2ec848304d157dfbe8e799a26825a763"
}
